Asymptotic and Uniform Diophantine Approximation Via Flows on Homogeneous Spaces,NSF,07/01/2022,06/30/2025,395545.00,395545,Standard Grant,03040000,MPS,Direct For Mathematical & Physical Scien,DMS,Division Of Mathematical Sciences,Marian Bocea,mbocea@nsf.gov,7032922595,"This project deals with certain dynamical systems of algebraic origin and their applications to number theory. A dynamical system here stands for an abstract set of points together with an evolution law that governs the way points move over time. Such abstract dynamical systems form the basis for models of a wide range of important phenomena in science and engineering. It turns out that many questions in mathematics concerning simultaneous approximation of real numbers by rational numbers can be understood in terms of the behavior of dynamical systems. Furthermore, systems that arise in this context are of algebraic nature, which makes it possible to use a wide variety of sophisticated tools for their investigation. This research project aims to advance the framework of algebraic dynamical systems in approximation theory, develop new methods, and obtain far-reaching generalizations of results in the field. Graduate and undergraduate students will be involved in the project and introduced to new methods and techniques in number theory and dynamics. These students will also supervise research projects within the framework of the PRIMES program, an after-school research program for high school students.&lt;br/&gt;&lt;br/&gt;During recent years there have been important developments concerning connections between Diophantine approximation and dynamical systems. This research project continues the study of phenomena in both dynamics and number theory related to asymptotic and uniform approximations. Among the mathematical tools to be employed are: Schmidt games and their modifications, integral inequalities of Eskin-Margulis-Mozes, effective mixing and equidistribution properties, Siegel-Rogers moment formulas, and parametric geometry of numbers.&lt;br/&gt;&lt;br/&gt;This award reflects NSF's statutory mission and has been deemed worthy of support through evaluation using the Foundation's intellectual merit and broader impacts review criteria.",04/01/2022,06/08/2022,,Grant,47.049,1,4900,4900,2155111,Dmitry,Kleinbock,Y,,Dmitry Y Kleinbock,kleinboc@brandeis.edu,000116626,04/01/2022,,Principal Investigator,,,,,,,,,,,,,,,,,,,,,,,,,,,,,,,,,,,,,,,,,Brandeis University,WALTHAM,024532728,7817362121,415 SOUTH ST,,United States,Massachusetts,MA,05,MA05,MXLZGAMFEKN5,BRANDEIS UNIVERSITY,JLC9RHNT9479,BRANDEIS UNIVERSITY,Waltham,MA,024549110,450 South St,US,United States,Massachusetts,1,05,MA05,1281,ANALYSIS PROGRAM,1281,ANALYSIS PROGRAM,,,,01002223DB,NSF RESEARCH & RELATED ACTIVIT,040100,2022~395545,,,,,,,,,,,,,,,,,,,,,,,,,,,,,,,,,,,,,,,,,,,,,,,,,,,,,,,,,,,,,,,,,,,,,,,,,,,,,,,,,,,,,,,,,,,,,,,,,,,,,,,,,,,,,,,,,,,,,,,,,,,,,,,,,,,,,,,,,,,,,,
Harnessing Pseudo One- and Two-Coordination for Reactivity and Magnetism,NSF,08/01/2022,07/31/2025,450000.00,450000,Standard Grant,03090000,MPS,Direct For Mathematical & Physical Scien,CHE,Division Of Chemistry,Tingyu Li,tli@nsf.gov,7032924949,"With support from the Chemical Structure, Dynamics &amp; Mechanisms-B (CSDM-B) Program of the Chemistry Division, Kyle Lancaster of the Department of Chemistry and Chemical Biology at Cornell University is developing new classes of two- and pseudo-one-coordinate transition metal complexes with interesting electronic and structural properties.  The goal of this research is to exploit the characteristics of these ultra-low-coordinate transition metal complexes for the discovery of new catalysts for group transfer reactions, as well as the development of new storage technologies, namely those based on single molecule magnets (SMMs), to meet the challenge of increasing data storage capacity in progressively smaller form factors. The project synergizes concepts of inorganic synthesis, materials chemistry, and physical chemistry, and is well suited as educational training for chemistry graduate students. Outreach activities involving K-12 students as well as the general public will also be supported by this project.  &lt;br/&gt;&lt;br/&gt;Recent studies have showcased the potential of open-shell, low-coordinate transition metal complexes as inexpensive catalysts for several important reactions and have demonstrated encouraging SMM behavior. In this project, the following questions will be addressed: 1) can bulky 1,8-diarylsubstituted carbazoles be used to generally synthesize heteroleptic, two-coordinate transition metal complexes? 2) Can these ligands support reduced metal centers in pseudo-one-coordinate environments? 3) To what extent do secondary interactions stabilize reactive metal ligand linkages? 4) To what extent can heterolepticity and metal identity be used to tune the electronic structures of the complexes and influence their magnetic properties?&lt;br/&gt;&lt;br/&gt;This award reflects NSF's statutory mission and has been deemed worthy of support through evaluation using the Foundation's intellectual merit and broader impacts review criteria.",07/10/2022,07/10/2022,,Grant,47.049,1,4900,4900,2155120,Kyle,Lancaster,M,,Kyle M Lancaster,kml236@cornell.edu,000559468,07/10/2022,,Principal Investigator,,,,,,,,,,,,,,,,,,,,,,,,,,,,,,,,,,,,,,,,,Cornell University,ITHACA,148502820,6072555014,341 PINE TREE RD,,United States,New York,NY,23,NY23,G56PUALJ3KT5,CORNELL UNIVERSITY,EQA8NBEN9WD5,Cornell University,Ithaca,NY,148502820,373 Pine Tree Road,US,United States,New York,1,23,NY23,9102,"Chem Struct,Dynmcs&Mechansms B",7203,QUANTUM INFORMATION SCIENCE,,,,01002223DB,NSF RESEARCH & RELATED ACTIVIT,040100,2022~450000,,,,,,,,,,,,,,,,,,,,,,,,,,,,,,,,,,,,,,,,,,,,,,,,,,,,,,,,,,,,,,,,,,,,,,,,,,,,,,,,,,,,,,,,,,,,,,,,,,,,,,,,,,,,,,,,,,,,,,,,,,,,,,,,,,,,,,,,,,,,,,
"RUI: Development of Bench-stable N-quaternized ketene N,O-acetals as Multifunctional Reagents for Organic Synthesis",NSF,06/01/2022,05/31/2025,246927.00,246927,Standard Grant,03090000,MPS,Direct For Mathematical & Physical Scien,CHE,Division Of Chemistry,Paul Blakemore,pblakemo@nsf.gov,7032922726,"With the support of the Chemical Synthesis program in the Division of Chemistry,  Max Majireck of Hamilton College is studying a new class of compounds that is useful for the manufacture of value-added materials such as pharmaceutical agents, agrochemicals, and other substances of use to society. Central to this research is a recent discovery made by the Majireck research group that reactive compounds known as N-quaternized ketene N,O-acetals, typically too delicate to be handled, can be prepared in a manner that stabilizes them. This important finding opens the door for such materials to be employed for the first time in the synthesis of a broad range of valuable compounds. For example, a goal of the funded project is to use the newly available class of N,O-acetals for the preparation of biologically active nitrogen-containing cyclic compounds commonly found as components in active pharmaceuticals. Furthermore, the research team will investigate a variety of processes involving the new reagents to uncover efficient methods for chemical manufacture that are straightforward and devoid of expensive additives, such as precious metal catalysts. The broader impacts of the project will extend to supporting research-based academic courses and summer research experiences for undergraduate students in synthetic organic chemistry at Hamilton College, with an emphasis on recruiting, training, and retaining students from underrepresented groups for careers in science, technology, engineering, and mathematics (STEM).&lt;br/&gt;&lt;br/&gt;N-Quaternized ketene N,O-acetals have been overlooked as reagents in organic synthesis due to their typical instability and/or specialized means of generation in situ. However, it was recently discovered that certain compounds within this class, and particularly pyridinium ketene N,O-acetals, have long-term bench-stability that allows for their preparation and purification in a straightforward manner. This opens up the possibility of leveraging N-quaternized ketene N,O-acetals as versatile reagents in organic synthesis. For example, such compounds can act as a source of thermally-generated O-alkyl ketenium ions, which can be used in acid catalyst-free Friedel-Crafts acylations, or in various cycloaddition reactions. Beyond the continued explorations of these kinds of processes, Dr. Majireck and his team of undergraduate students will also study the use of 2-halo-N-(1-alkoxyvinyl)pyridinium salts as electrophiles for the production of 2-aminopyridine derivatives via mild nucleophilic aromatic substitution reactions. The research will provide valuable opportunities for undergraduate students, particularly those from groups traditionally underrepresented in STEM, to partake in immersive research experiences which are anticipated to contribute toward a strengthening and diversification of the U.S. scientific workforce.&lt;br/&gt;&lt;br/&gt;This award reflects NSF's statutory mission and has been deemed worthy of support through evaluation using the Foundation's intellectual merit and broader impacts review criteria.",04/06/2022,04/06/2022,,Grant,47.049,1,4900,4900,2155127,Max,Majireck,M,,Max M Majireck,mmajirec@hamilton.edu,000699555,04/06/2022,,Principal Investigator,,,,,,,,,,,,,,,,,,,,,,,,,,,,,,,,,,,,,,,,,Hamilton College,CLINTON,133231218,3158594678,198 COLLEGE HILL RD,,United States,New York,NY,22,NY22,Z6WLZ6RDFDM7,HAMILTON COLLEGE,Z6WLZ6RDFDM7,Hamilton College,Clinton,NY,133231218,198 College Hill Rd.,US,United States,New York,1,22,NY22,6878,Chemical Synthesis,8037,Advanced Manufacturing,,,,01002223DB,NSF RESEARCH & RELATED ACTIVIT,040100,2022~246927,9229,RES IN UNDERGRAD INST-RESEARCH,,,,,,,,,,,,,,,,,,,,,,,,,,,,,,,,,,,,,,,,,,,,,,,,,,,,,,,,,,,,,,,,,,,,,,,,,,,,,,,,,,,,,,,,,,,,,,,,,,,,,,,,,,,,,,,,,,,,,,,,,,,,,,,,,,,,,,,,,,,,
CAS: Quantifying the Systematic Catalytic Surface Chemistry of Non-Noble Metal Intermetallic Compounds to Achieve Diol and Olefin Production in Polyol Deoxygenation Reactions,NSF,08/01/2022,07/31/2025,353295.00,353295,Standard Grant,03090000,MPS,Direct For Mathematical & Physical Scien,CHE,Division Of Chemistry,Laura Anderson,laanders@nsf.gov,7032922934,"With the support of the Chemical Catalysis Program in the Division of Chemistry, Siris Laursen of the University of Tennessee, Knoxville is developing inexpensive, earth-abundant catalysts for the valorization of waste from biomass pyrolysis and bio-diesel production. The future of a fully integrated biorefinery is contingent upon the efficient and selective conversion of all parts of biomass to value-added compounds. Dr. Laursen and his team are studying non-noble metal intermetallic compounds as catalysts to selectively form diols and olefins (building block chemicals) from water waste streams generated during biomass processing. These catalysts will be tuned in an effort to provide greater activity for the removal of oxygen atoms from the waste products, lower activity for carbon-carbon bond fragmentation, and lower activity for olefin hydrogenation. Simultaneously, a general understanding of the composition-activity relationships of the catalysts is being developed to improve predictive performance, accelerate catalyst discovery, and advance catalyst sustainability. This research project is expected to impact K-12, undergraduate, and graduate education by integrating students directly into the research group through summer experiences to build an educated workforce to support new renewable chemicals industries. Institutional programs are being used to support the inclusivity of these experiences and to identify students who may benefit the most from these activities.&lt;br/&gt;&lt;br/&gt;Non-noble intermetallic compounds are compositionally ordered solids composed of transition metals and post-transition metals or semimetals that have exhibited promising properties for the partial or complete deoxygenation of glycerol to 1,2-propanediol and propene. Siris Laursen and his research group are utilizing a combination of quantum chemical surface reaction modeling and experimental investigations to determine the composition-activity relationships of these compositionally complex catalysts and accelerate the discovery of materials that can produce valuable chemicals from polyols. Specific ranges of surface chemistry that promote the partial and complete removal of oxygens from polyols to produce valuable diols and olefins are being determined. Likewise, catalyst compositions that exhibit more aggressive surface chemistry to drive the complete breakdown of polyols to produce hydrogen (H2) and CO are also being noted. By understanding the origin of the special surface chemistry of intermetallic compounds at the atomic and electronic levels, Dr. Laursen and his students are working to develop simple fundamental design rules for non-noble metal catalysts that may be used in a wide range of chemical transformations that still lack efficient catalytic materials. Moreover, by integrating research and education, this project is promoting the education of a diverse group of future scientists and building an educated workforce for the biorefinery sector.&lt;br/&gt;&lt;br/&gt;This award reflects NSF's statutory mission and has been deemed worthy of support through evaluation using the Foundation's intellectual merit and broader impacts review criteria.",07/22/2022,07/22/2022,,Grant,47.049,1,4900,4900,2155037,Siris,Laursen,O,,Siris O Laursen,slaursen@utk.edu,000644004,07/22/2022,,Principal Investigator,Nicholas,Feamster,G,,Nicholas G Feamster,feamster@uchicago.edu,000489704,07/29/2022,,Principal Investigator,,,,,,,,,,,,,,,,,,,,,,,,,,,,,,,University of Tennessee Knoxville,Knoxville,379163801,8659743466,1331 CIR PARK DR,,United States,Tennessee,TN,02,TN02,FN2YCS2YAUW3,UNIVERSITY OF TENNESSEE,FN2YCS2YAUW3,University of Tennessee Knoxville,Knoxville,TN,379163801,1331 Circle Park Dr,US,United States,Tennessee,1,02,TN02,6884,Chemical Catalysis,090Z,CAS-Critical Aspects of Sustainability,,,,01002223DB,NSF RESEARCH & RELATED ACTIVIT,040100,2022~353295,8037,Advanced Manufacturing,8060,Secure &Trustworthy Cyberspace,,025Z,SaTC: Secure and Trustworthy Cyberspace,7923,SMALL PROJECT,,,"SaTC: CORE: Small: Understanding Practical Deployment Considerations for Decentralized, Encrypted DNS",NSF,08/01/2022,07/31/2025,500000.00,500000,Standard Grant,05050000,CSE,Direct For Computer & Info Scie & Enginr,CNS,Division Of Computer and Network Systems,Alexander Sprintson,asprints@nsf.gov,7032922170,"The Domain Name System (DNS) is the Internet protocol and system that maps human-readable names to Internet protocol addresses; it is central to every Internet activity, from web browsing to video streaming. Despite the central role of the DNS in essentially all Internet communications, until recently it has been unencrypted, which has introduced significant privacy risks and vulnerabilities. In recent years, technology to encrypt DNS queries and responses includes transmitting DNS queries and responses. This project is studying the performance and privacy properties of existing encrypted DNS protocols such as DoH and DoT, towards the ultimate goal of deploying applications and systems that use these new protocols to improve user privacy and provide users satisfactory performance.  The Internet is rapidly moving towards encrypted DNS protocols, with encrypted DNS now either available or enabled by default in many standard Internet browsers and Internet-connected embedded devices.  Yet, there is relatively little knowledge or agreement about the performance and privacy characteristics of such protocols.  This project builds on the early work in this area to develop comprehensive techniques for evaluating both the performance and privacy of new network applications, systems, and architectures that rely on encrypted DNS protocols.  The research will contribute to the larger body of knowledge on both DNS performance and privacy, and the available performance and evaluation frameworks for evaluating encrypted DNS protocols will be released to the community to allow others to continue to build on these results.&lt;br/&gt;&lt;br/&gt;The first theme of this project seeks to understand the performance implications of existing encrypted DNS protocols and architectures, on DNS lookup time, as well as on the performance of popular Internet applications whose performance depends on the DNS, particularly for metrics such as web page load time.  Understanding why (and when) encrypted DNS outperforms unencrypted DNS---as well as when it does not---will ultimately shed light on how to best architect DNS resolution to ensure both confidentiality and good performance. The second theme of this project recognizes that encrypting DNS need not imply centralization. Distributing a client's DNS queries across multiple recursive resolvers may improve reliability, privacy, and even performance, although such improvements will ultimately require the design of appropriate strategies for distributing these queries. This theme explores the prospect of re-decentralizing the DNS.  Third, the project is coalescing various approaches to DNS privacy---from DNS encryption to previous work on oblivious DNS (ODNS)---into a coherent architectural framework. This theme explores how and where DNS privacy extensions could be deployed (e.g., in a local DNS resolver, in a web browser) to both preserve user privacy and preserve a seamless user experience.&lt;br/&gt;&lt;br/&gt;This award reflects NSF's statutory mission and has been deemed worthy of support through evaluation using the Foundation's intellectual merit and broader impacts review criteria.",07/29/2022,07/29/2022,,Grant,47.070,1,4900,4900,2155128,University of Chicago,CHICAGO,606375418,7737028669,5801 S ELLIS AVE,,United States,Illinois,IL,01,IL01,ZUE9HKT2CLC9,UNIVERSITY OF CHICAGO,ZUE9HKT2CLC9,The University of Chicago,Chicago,IL,606372612,5730 South Ellis Avenue,US,United States,Illinois,1,01,IL01,,,,01002223DB,NSF RESEARCH & RELATED ACTIVIT,040100,2022~500000,,,,,,,,,,,,,,,,,,,,,,,,,,,,,,,,,,,,,,,,,,,,,,,,,,,,,,,,,,,,,,,,,,,,,,,,,,
SaTC: CORE: Small: Enabling Mobile Users to Solve Privacy Issues with Their Own Hands Unobtrusively based on Gripping Hand Sensing,NSF,06/15/2022,05/31/2025,471429.00,471429,Standard Grant,05050000,CSE,Direct For Computer & Info Scie & Enginr,CNS,Division Of Computer and Network Systems,Jeremy Epstein,jepstein@nsf.gov,7032928338,"Smartphones have become our most intimate devices. To protect against unauthorized access, many authentication methods (e.g., PINs, fingerprints, and face IDs) have been deployed. However, by requiring active user efforts to input biometric data, they are unable to cope with many scenarios when user participation is not available at once, such as when the smartphone is shared with others or when notification content is displayed on the screen spontaneously. Furthermore, while biometric data have become more popular for authentication, it can be eavesdropped and reused. This research addresses the two long-standing issues of biometric authentication, obtrusiveness and replay threat, based on gripping-hand sensing. The key insight is that for a handheld device, the user needs to hold the device to use it. The project’s novelties are enabling smartphone users to solve access issues with their own hands unobtrusively, extracting nonreusable biometric features for authentication, and using media sounds to sense the user’s gripping hand. The project's broader significance and importance are that it benefits the huge population of smartphone users by providing enhanced mobile security, disseminates the research outcomes to the public to benefit both industry and academia, and contributes to educational programs, including curriculum development, graduate/undergraduate training, K-12 involvement, and underrepresented student engagement in research. &lt;br/&gt;&lt;br/&gt;This project advances the knowledge of mobile device security and privacy. It explores a novel gripping-hand biometric for user identification, which is readily available to acquire visually or acoustically from mobile device users. Deep learning-based algorithms are developed to derive unique biometric features and distinguish people’s hands. The project further devises a technique based on modulated stimulus signals to encode biometric features into each non-repeated biometric code for challenge-response user authentication. Moreover, cross-domain user authentication methods are developed, which leverage commonly used smartphone audio signals (e.g., ringtones) to sense and recognize a user’s gripping hand rather than using dedicated signals. The hard-to-forge physical relationships between the resulting acoustic and vibration responses of such audio signals are explored for achieving replay resistance.&lt;br/&gt;&lt;br/&gt;This award reflects NSF's statutory mission and has been deemed worthy of support through evaluation using the Foundation's intellectual merit and broader impacts review criteria.",06/10/2022,06/10/2022,,Grant,47.070,1,4900,4900,2155131,Chen,Wang,,,Chen Wang,chenwang1@lsu.edu,000817720,06/10/2022,,Principal Investigator,,,,,,,,,,,,,,,,,,,,,,,,,,,,,,,,,,,,,,,,,Louisiana State University,BATON ROUGE,708030001,2255782760,202 HIMES HALL,,United States,Louisiana,LA,06,LA06,ECQEYCHRNKJ4,LOUISIANA STATE UNIVERSITY,Z7ZNZH7LJ778,Louisiana State University and A&M College,Baton Rouge,LA,708032701,,US,United States,Louisiana,1,06,LA06,8060,Secure &Trustworthy Cyberspace,025Z,SaTC: Secure and Trustworthy Cyberspace,,,,01002223DB,NSF RESEARCH & RELATED ACTIVIT,040100,2022~471429,7923,SMALL PROJECT,,,,9150,EXP PROG TO STIM COMP RES,,,,,,,,,,,,,,,,,,,,,,,,,,,,,,,,,,,,,,,,,,,,,,,,,,,,,,,,,,,,,,,,,,,,,,,,,,,,,,,,,,,,,,,,,,,,,,,,,,,,,,,,,,,,,,,,,,,,,,,,,,,,,,,,,,,,,,,
