rootTag.Award.AwardTitle,rootTag.Award.AGENCY,rootTag.Award.AwardEffectiveDate,rootTag.Award.AwardExpirationDate,rootTag.Award.AwardTotalIntnAmount,rootTag.Award.AwardAmount,rootTag.Award.AwardInstrument.Value,rootTag.Award.Organization.Code,rootTag.Award.Organization.Directorate.Abbreviation,rootTag.Award.Organization.Directorate.LongName,rootTag.Award.Organization.Division.Abbreviation,rootTag.Award.Organization.Division.LongName,rootTag.Award.ProgramOfficer.SignBlockName,rootTag.Award.ProgramOfficer.PO_EMAI,rootTag.Award.ProgramOfficer.PO_PHON,rootTag.Award.AbstractNarration,rootTag.Award.MinAmdLetterDate,rootTag.Award.MaxAmdLetterDate,rootTag.Award.ARRAAmount,rootTag.Award.TRAN_TYPE,rootTag.Award.CFDA_NUM,rootTag.Award.NSF_PAR_USE_FLAG,rootTag.Award.FUND_AGCY_CODE,rootTag.Award.AWDG_AGCY_CODE,rootTag.Award.AwardID,rootTag.Award.Investigator.FirstName,rootTag.Award.Investigator.LastName,rootTag.Award.Investigator.PI_MID_INIT,rootTag.Award.Investigator.PI_SUFX_NAME,rootTag.Award.Investigator.PI_FULL_NAME,rootTag.Award.Investigator.EmailAddress,rootTag.Award.Investigator.NSF_ID,rootTag.Award.Investigator.StartDate,rootTag.Award.Investigator.EndDate,rootTag.Award.Investigator.RoleCode,rootTag.Award.Investigator.FirstName.0,rootTag.Award.Investigator.LastName.0,rootTag.Award.Investigator.PI_MID_INIT.0,rootTag.Award.Investigator.PI_SUFX_NAME.0,rootTag.Award.Investigator.PI_FULL_NAME.0,rootTag.Award.Investigator.EmailAddress.0,rootTag.Award.Investigator.NSF_ID.0,rootTag.Award.Investigator.StartDate.0,rootTag.Award.Investigator.EndDate.0,rootTag.Award.Investigator.RoleCode.0,rootTag.Award.Investigator.FirstName.1,rootTag.Award.Investigator.LastName.1,rootTag.Award.Investigator.PI_MID_INIT.1,rootTag.Award.Investigator.PI_SUFX_NAME.1,rootTag.Award.Investigator.PI_FULL_NAME.1,rootTag.Award.Investigator.EmailAddress.1,rootTag.Award.Investigator.NSF_ID.1,rootTag.Award.Investigator.StartDate.1,rootTag.Award.Investigator.EndDate.1,rootTag.Award.Investigator.RoleCode.1,rootTag.Award.Investigator.FirstName.2,rootTag.Award.Investigator.LastName.2,rootTag.Award.Investigator.PI_MID_INIT.2,rootTag.Award.Investigator.PI_SUFX_NAME.2,rootTag.Award.Investigator.PI_FULL_NAME.2,rootTag.Award.Investigator.EmailAddress.2,rootTag.Award.Investigator.NSF_ID.2,rootTag.Award.Investigator.StartDate.2,rootTag.Award.Investigator.EndDate.2,rootTag.Award.Investigator.RoleCode.2,rootTag.Award.Investigator.FirstName.3,rootTag.Award.Investigator.LastName.3,rootTag.Award.Investigator.PI_MID_INIT.3,rootTag.Award.Investigator.PI_SUFX_NAME.3,rootTag.Award.Investigator.PI_FULL_NAME.3,rootTag.Award.Investigator.EmailAddress.3,rootTag.Award.Investigator.NSF_ID.3,rootTag.Award.Investigator.StartDate.3,rootTag.Award.Investigator.EndDate.3,rootTag.Award.Investigator.RoleCode.3,rootTag.Award.Institution.Name,rootTag.Award.Institution.CityName,rootTag.Award.Institution.ZipCode,rootTag.Award.Institution.PhoneNumber,rootTag.Award.Institution.StreetAddress,rootTag.Award.Institution.StreetAddress2,rootTag.Award.Institution.CountryName,rootTag.Award.Institution.StateName,rootTag.Award.Institution.StateCode,rootTag.Award.Institution.CONGRESSDISTRICT,rootTag.Award.Institution.CONGRESS_DISTRICT_ORG,rootTag.Award.Institution.ORG_UEI_NUM,rootTag.Award.Institution.ORG_LGL_BUS_NAME,rootTag.Award.Institution.ORG_PRNT_UEI_NUM,rootTag.Award.Performance_Institution.Name,rootTag.Award.Performance_Institution.CityName,rootTag.Award.Performance_Institution.StateCode,rootTag.Award.Performance_Institution.ZipCode,rootTag.Award.Performance_Institution.StreetAddress,rootTag.Award.Performance_Institution.CountryCode,rootTag.Award.Performance_Institution.CountryName,rootTag.Award.Performance_Institution.StateName,rootTag.Award.Performance_Institution.CountryFlag,rootTag.Award.Performance_Institution.CONGRESSDISTRICT,rootTag.Award.Performance_Institution.CONGRESS_DISTRICT_PERF,rootTag.Award.ProgramElement.Code,rootTag.Award.ProgramElement.Text,rootTag.Award.ProgramReference.Code,rootTag.Award.ProgramReference.Text,rootTag.Award.Appropriation.Code,rootTag.Award.Appropriation.Name,rootTag.Award.Appropriation.APP_SYMB_ID,rootTag.Award.Fund.Code,rootTag.Award.Fund.Name,rootTag.Award.Fund.FUND_SYMB_ID,rootTag.Award.FUND_OBLG,rootTag.Award.ProgramReference.Code.0,rootTag.Award.ProgramReference.Text.0,rootTag.Award.ProgramElement.Code.0,rootTag.Award.ProgramElement.Text.0,rootTag.Award.Investigator.PI_PHON,rootTag.Award.ProgramReference.Code.1,rootTag.Award.ProgramReference.Text.1,rootTag.Award.ProgramReference.Code.2,rootTag.Award.ProgramReference.Text.2,rootTag.Award.ProgramReference.Code.3,rootTag.Award.ProgramReference.Text.3,rootTag.Award.AwardTitle.0,rootTag.Award.AGENCY.0,rootTag.Award.AwardEffectiveDate.0,rootTag.Award.AwardExpirationDate.0,rootTag.Award.AwardTotalIntnAmount.0,rootTag.Award.AwardAmount.0,rootTag.Award.AwardInstrument.Value.0,rootTag.Award.Organization.Code.0,rootTag.Award.Organization.Directorate.Abbreviation.0,rootTag.Award.Organization.Directorate.LongName.0,rootTag.Award.Organization.Division.Abbreviation.0,rootTag.Award.Organization.Division.LongName.0,rootTag.Award.ProgramOfficer.SignBlockName.0,rootTag.Award.ProgramOfficer.PO_EMAI.0,rootTag.Award.ProgramOfficer.PO_PHON.0,rootTag.Award.AbstractNarration.0,rootTag.Award.MinAmdLetterDate.0,rootTag.Award.MaxAmdLetterDate.0,rootTag.Award.ARRAAmount.0,rootTag.Award.TRAN_TYPE.0,rootTag.Award.CFDA_NUM.0,rootTag.Award.NSF_PAR_USE_FLAG.0,rootTag.Award.FUND_AGCY_CODE.0,rootTag.Award.AWDG_AGCY_CODE.0,rootTag.Award.AwardID.0,rootTag.Award.Institution.Name.0,rootTag.Award.Institution.CityName.0,rootTag.Award.Institution.ZipCode.0,rootTag.Award.Institution.PhoneNumber.0,rootTag.Award.Institution.StreetAddress.0,rootTag.Award.Institution.StreetAddress2.0,rootTag.Award.Institution.CountryName.0,rootTag.Award.Institution.StateName.0,rootTag.Award.Institution.StateCode.0,rootTag.Award.Institution.CONGRESSDISTRICT.0,rootTag.Award.Institution.CONGRESS_DISTRICT_ORG.0,rootTag.Award.Institution.ORG_UEI_NUM.0,rootTag.Award.Institution.ORG_LGL_BUS_NAME.0,rootTag.Award.Institution.ORG_PRNT_UEI_NUM.0,rootTag.Award.Performance_Institution.Name.0,rootTag.Award.Performance_Institution.CityName.0,rootTag.Award.Performance_Institution.StateCode.0,rootTag.Award.Performance_Institution.ZipCode.0,rootTag.Award.Performance_Institution.StreetAddress.0,rootTag.Award.Performance_Institution.CountryCode.0,rootTag.Award.Performance_Institution.CountryName.0,rootTag.Award.Performance_Institution.StateName.0,rootTag.Award.Performance_Institution.CountryFlag.0,rootTag.Award.Performance_Institution.CONGRESSDISTRICT.0,rootTag.Award.Performance_Institution.CONGRESS_DISTRICT_PERF.0,rootTag.Award.Appropriation.Code.0,rootTag.Award.Appropriation.Name.0,rootTag.Award.Appropriation.APP_SYMB_ID.0,rootTag.Award.Fund.Code.0,rootTag.Award.Fund.Name.0,rootTag.Award.Fund.FUND_SYMB_ID.0,rootTag.Award.FUND_OBLG.0,rootTag.Award.ProgramElement.Code.1,rootTag.Award.ProgramElement.Text.1,rootTag.Award.Investigator.FirstName.4,rootTag.Award.Investigator.LastName.4,rootTag.Award.Investigator.PI_MID_INIT.4,rootTag.Award.Investigator.PI_SUFX_NAME.4,rootTag.Award.Investigator.PI_FULL_NAME.4,rootTag.Award.Investigator.EmailAddress.4,rootTag.Award.Investigator.NSF_ID.4,rootTag.Award.Investigator.StartDate.4,rootTag.Award.Investigator.EndDate.4,rootTag.Award.Investigator.RoleCode.4,rootTag.Award.ProgramReference.Code.4,rootTag.Award.ProgramReference.Text.4,rootTag.Award.Investigator.PI_PHON.0,rootTag.Award.AwardTitle.1,rootTag.Award.AGENCY.1,rootTag.Award.AwardEffectiveDate.1,rootTag.Award.AwardExpirationDate.1,rootTag.Award.AwardTotalIntnAmount.1,rootTag.Award.AwardAmount.1,rootTag.Award.AwardInstrument.Value.1,rootTag.Award.Organization.Code.1,rootTag.Award.Organization.Directorate.Abbreviation.1,rootTag.Award.Organization.Directorate.LongName.1,rootTag.Award.Organization.Division.Abbreviation.1,rootTag.Award.Organization.Division.LongName.1,rootTag.Award.ProgramOfficer.SignBlockName.1,rootTag.Award.ProgramOfficer.PO_EMAI.1,rootTag.Award.ProgramOfficer.PO_PHON.1,rootTag.Award.AbstractNarration.1,rootTag.Award.MinAmdLetterDate.1,rootTag.Award.MaxAmdLetterDate.1,rootTag.Award.ARRAAmount.1,rootTag.Award.TRAN_TYPE.1,rootTag.Award.CFDA_NUM.1,rootTag.Award.NSF_PAR_USE_FLAG.1,rootTag.Award.FUND_AGCY_CODE.1,rootTag.Award.AWDG_AGCY_CODE.1,rootTag.Award.AwardID.1,rootTag.Award.Institution.Name.1,rootTag.Award.Institution.CityName.1,rootTag.Award.Institution.ZipCode.1,rootTag.Award.Institution.PhoneNumber.1,rootTag.Award.Institution.StreetAddress.1,rootTag.Award.Institution.StreetAddress2.1,rootTag.Award.Institution.CountryName.1,rootTag.Award.Institution.StateName.1,rootTag.Award.Institution.StateCode.1,rootTag.Award.Institution.CONGRESSDISTRICT.1,rootTag.Award.Institution.CONGRESS_DISTRICT_ORG.1,rootTag.Award.Institution.ORG_UEI_NUM.1,rootTag.Award.Institution.ORG_LGL_BUS_NAME.1,rootTag.Award.Institution.ORG_PRNT_UEI_NUM.1,rootTag.Award.Performance_Institution.Name.1,rootTag.Award.Performance_Institution.CityName.1,rootTag.Award.Performance_Institution.StateCode.1,rootTag.Award.Performance_Institution.ZipCode.1,rootTag.Award.Performance_Institution.StreetAddress.1,rootTag.Award.Performance_Institution.CountryCode.1,rootTag.Award.Performance_Institution.CountryName.1,rootTag.Award.Performance_Institution.StateName.1,rootTag.Award.Performance_Institution.CountryFlag.1,rootTag.Award.Performance_Institution.CONGRESSDISTRICT.1,rootTag.Award.Performance_Institution.CONGRESS_DISTRICT_PERF.1,rootTag.Award.ProgramElement.Code.2,rootTag.Award.ProgramElement.Text.2,rootTag.Award.ProgramReference.Code.5,rootTag.Award.ProgramReference.Text.5,rootTag.Award.ProgramReference.Code.6,rootTag.Award.ProgramReference.Text.6,rootTag.Award.FUND_OBLG.1,rootTag.Award.Investigator.PI_PHON.1,rootTag.Award.Investigator.PI_PHON.2
"CI CoE: Demo Pilot: Advancing Research Computing and Data: Strategic Tools, Practices, and Professional Development",NSF,05/15/2021,04/30/2023,1497243.00,1497243,Standard Grant,05090000,CSE,Direct For Computer & Info Scie & Enginr,OAC,Office of Advanced Cyberinfrastructure (OAC),Varun Chandola,vchandol@nsf.gov,7032922656,"Research is increasingly dependent upon Cyberinfrastructure (CI), from instruments and sensors to Research Computing and Data (RCD) infrastructure and services. High Performance Computing (HPC) is an important element, however RCD has expanded well beyond HPC into secure enclaves for data compliance; big data management, analytics, and movement; AI/machine learning; and more recently into heterogeneous compute models, edge computing, and cloud-based computing. Researchers are struggling to keep pace with the explosion of data and the rapid evolution of computing resources, and often lack the skills to make full use of emerging tools and techniques. Developing and maintaining the needed expertise takes valuable time from research and is often beyond the capacity of researchers; they must depend upon partners (RCD professionals) who combine technology expertise and an understanding of research workflows and researcher needs. Institutions face challenges recruiting and retaining RCD professional staff, and building effective RCD support services. This CI CoE Demonstration Pilot (RCD CoE) will develop an RCD Resource and Career Center to advance and enable the nation's capacity for computational and data-intensive research by providing institutions and individuals the products, tools, services, and community to build and sustain successful RCD operations.  The project will also provide expertise in the development of new RCD professionals, and provide a voice and a connector for the broad community and the profession at large. &lt;br/&gt;&lt;br/&gt;The RCD Resource and Career Center will build upon work that the NSF-supported Campus Research Computing Consortium (CaRCC) has done and continues to do to develop products and tools for effective RCD support. The Center will develop a robust and sustainable implementation of the RCD Capabilities Model that provides an assessment framework, support for benchmarking and strategic planning, and a community data set to understand the landscape of RCD support. The Center will expand and disseminate resources for RCD Professionalization, including support for adoption of an RCD Job Family Matrix to properly classify RCD professional roles and conducting a national census of RCD Professionals to characterize the current state of RCD staff and programs. The Center will create and disseminate a model of Career Arcs for RCD Professionals to explain career options and help existing RCD professionals explore professional development and advancement. Work in the project will aggregate resources for staff training and workforce development, including leading practices for recruitment, onboarding, advancing diversity, equity and inclusion (DEI), and professional development, as well as proven models for student internship and training programs. The pilot period and the community of communities will be used to facilitate the creation of a coordinating organization to connect all the relevant communities and to develop a shared voice for RCD professionals as the project plans for a full Center of Excellence.&lt;br/&gt;&lt;br/&gt;This award reflects NSF's statutory mission and has been deemed worthy of support through evaluation using the Foundation's intellectual merit and broader impacts review criteria.",05/19/2021,05/19/2021,,Grant,47.070,1,4900,4900,2100003,Thomas,Cheatham,E,III,Thomas E Cheatham,tec3@utah.edu,000095070,05/19/2021,,Co-Principal Investigator,Dana,Brunson,,,Dana Brunson,dbrunson@internet2.edu,000548697,05/19/2021,,Principal Investigator,Scott,Yockel,,,Scott Yockel,syockel@g.harvard.edu,000753904,05/19/2021,,Co-Principal Investigator,Patrick,Schmitz,,,Patrick Schmitz,pschmitz@internet2.edu,000764398,05/19/2021,,Co-Principal Investigator,Claire,Mizumoto,E,,Claire E Mizumoto,claire@ucsd.edu,000829737,05/19/2021,,Co-Principal Investigator,INTERNET2,WASHINGTON,200363846,7349134264,1150 18TH ST NW,STE 900,United States,District of Columbia,DC,00,DC00,DZEBKFRD1ZN6,UNIVERSITY CORPORATION FOR ADVANCED INTERNET DEVELOPMENT,,Internet2,Washington,DC,200363825,1150 18th St NW,US,United States,District of Columbia,1,00,DC00,7231,CYBERINFRASTRUCTURE,9102,"WOMEN, MINORITY, DISABLED, NEC",0121,NSF RESEARCH & RELATED ACTIVIT,040100,01002122DB,NSF RESEARCH & RELATED ACTIVIT,040100,2021~1497243,,,,,,,,,,,,,,,,,,,,,,,,,,,,,,,,,,,,,,,,,,,,,,,,,,,,,,,,,,,,,,,,,,,,,,,,,,,,,,,,,,,,,,,,,,,,,,,,,,,,,,,,,,,,,,,,,,,,,,,,,,,,,,,,,,,,,,,,,,,,,,
"Noncommutative Functions, Algebra and Operator Analysis",NSF,08/15/2022,07/31/2025,110448.00,110448,Standard Grant,03040000,MPS,Direct For Mathematical & Physical Scien,DMS,Division Of Mathematical Sciences,Constanze Liaw,cliaw@nsf.gov,7032928042,"Noncommutativity is the idea that the order of operations matters; socks before shoes is very different than shoes before socks. Noncommutativity played a fundamental role in the foundation of quantum mechanics, leading to the development of the branch of mathematics known as functional analysis. From its origins in physics, functional analysis has gained a life of its own and has found exciting applications in areas such as quantum information theory and quantum computing as well as control and systems theory. More recently, questions (about semi-definite programming and linear matrix inequalities) arising in the engineering literature have led to the development of a new subfield of functional analysis known as noncommutative function theory. This exciting new subfield sits at the intersection of noncommutative algebra, functional analysis, and operator theory, and it enjoys a wide variety of applications. Rather than deal with completely abstract mathematical objects, noncommutative function theory employs the use of concrete structures known as matrices, which are one of the fundamental noncommutative objects used in science, engineering and industry. This project aims to deepen the understanding of noncommutative function theory and consequently augment its connections to related mathematical fields. It will assist in the professional development of early researches and provide an up-to-date list of both solved and unsolved problems in the field of noncommutative function theory.&lt;br/&gt;             &lt;br/&gt;One of the main goals of this project is to increase the interplay between noncommutative function theory, noncommutative algebra, and operator theory. Recently, theorems and advances have been made in noncommutative algebra through techniques in noncommutative function theory, complex analysis, and operator theory. Objects of interest will be noncommutative rational functions and how their evaluations on matrices and operators reveals algebraic information about the functions and the skew field they generate; there is a strong connection between the injectivity domains of noncommutative rational mappings, the invertibility sets of their Jacobian matrices, and whether the noncommutative rational mapping induces an automorphism of the free skew field. On the other hand, results from noncommutative algebra (such as the realization of a noncommutative rational function) will be used to deepen the understanding of topics in mathematical analysis. Employment of novel ideas from noncommutative algebra and noncommutative function theory will provide new insights into the study of optimal polynomial approximants and related areas.&lt;br/&gt;&lt;br/&gt;This award reflects NSF's statutory mission and has been deemed worthy of support through evaluation using the Foundation's intellectual merit and broader impacts review criteria.",08/02/2022,08/02/2022,,Grant,47.049,1,4900,4900,2155033,Meric,Augat,L,,Meric L Augat,maugat@wustl.edu,000838246,08/02/2022,,Principal Investigator,,,,,,,,,,,,,,,,,,,,,,,,,,,,,,,,,,,,,,,,,Washington University,SAINT LOUIS,631304862,3147474134,ONE BROOKINGS DR,,United States,Missouri,MO,01,MO01,L6NFUM28LQM5,"WASHINGTON UNIVERSITY, THE",L6NFUM28LQM5,Washington University,,MO,631304899,,US,United States,Missouri,1,01,MO01,1281,ANALYSIS PROGRAM,,,,,,01002223DB,NSF RESEARCH & RELATED ACTIVIT,040100,2022~110448,,,,,,,,,,,,,,,,,,,,,,,,,,,,,,,,,,,,,,,,,,,,,,,,,,,,,,,,,,,,,,,,,,,,,,,,,,,,,,,,,,,,,,,,,,,,,,,,,,,,,,,,,,,,,,,,,,,,,,,,,,,,,,,,,,,,,,,,,,,,,,
CAS: Quantifying the Systematic Catalytic Surface Chemistry of Non-Noble Metal Intermetallic Compounds to Achieve Diol and Olefin Production in Polyol Deoxygenation Reactions,NSF,08/01/2022,07/31/2025,353295.00,353295,Standard Grant,03090000,MPS,Direct For Mathematical & Physical Scien,CHE,Division Of Chemistry,Laura Anderson,laanders@nsf.gov,7032922934,"With the support of the Chemical Catalysis Program in the Division of Chemistry, Siris Laursen of the University of Tennessee, Knoxville is developing inexpensive, earth-abundant catalysts for the valorization of waste from biomass pyrolysis and bio-diesel production. The future of a fully integrated biorefinery is contingent upon the efficient and selective conversion of all parts of biomass to value-added compounds. Dr. Laursen and his team are studying non-noble metal intermetallic compounds as catalysts to selectively form diols and olefins (building block chemicals) from water waste streams generated during biomass processing. These catalysts will be tuned in an effort to provide greater activity for the removal of oxygen atoms from the waste products, lower activity for carbon-carbon bond fragmentation, and lower activity for olefin hydrogenation. Simultaneously, a general understanding of the composition-activity relationships of the catalysts is being developed to improve predictive performance, accelerate catalyst discovery, and advance catalyst sustainability. This research project is expected to impact K-12, undergraduate, and graduate education by integrating students directly into the research group through summer experiences to build an educated workforce to support new renewable chemicals industries. Institutional programs are being used to support the inclusivity of these experiences and to identify students who may benefit the most from these activities.&lt;br/&gt;&lt;br/&gt;Non-noble intermetallic compounds are compositionally ordered solids composed of transition metals and post-transition metals or semimetals that have exhibited promising properties for the partial or complete deoxygenation of glycerol to 1,2-propanediol and propene. Siris Laursen and his research group are utilizing a combination of quantum chemical surface reaction modeling and experimental investigations to determine the composition-activity relationships of these compositionally complex catalysts and accelerate the discovery of materials that can produce valuable chemicals from polyols. Specific ranges of surface chemistry that promote the partial and complete removal of oxygens from polyols to produce valuable diols and olefins are being determined. Likewise, catalyst compositions that exhibit more aggressive surface chemistry to drive the complete breakdown of polyols to produce hydrogen (H2) and CO are also being noted. By understanding the origin of the special surface chemistry of intermetallic compounds at the atomic and electronic levels, Dr. Laursen and his students are working to develop simple fundamental design rules for non-noble metal catalysts that may be used in a wide range of chemical transformations that still lack efficient catalytic materials. Moreover, by integrating research and education, this project is promoting the education of a diverse group of future scientists and building an educated workforce for the biorefinery sector.&lt;br/&gt;&lt;br/&gt;This award reflects NSF's statutory mission and has been deemed worthy of support through evaluation using the Foundation's intellectual merit and broader impacts review criteria.",07/22/2022,07/22/2022,,Grant,47.049,1,4900,4900,2155037,Siris,Laursen,O,,Siris O Laursen,slaursen@utk.edu,000644004,07/22/2022,,Principal Investigator,,,,,,,,,,,,,,,,,,,,,,,,,,,,,,,,,,,,,,,,,University of Tennessee Knoxville,Knoxville,379163801,8659743466,1331 CIR PARK DR,,United States,Tennessee,TN,02,TN02,FN2YCS2YAUW3,UNIVERSITY OF TENNESSEE,FN2YCS2YAUW3,University of Tennessee Knoxville,Knoxville,TN,379163801,1331 Circle Park Dr,US,United States,Tennessee,1,02,TN02,6884,Chemical Catalysis,090Z,CAS-Critical Aspects of Sustainability,,,,01002223DB,NSF RESEARCH & RELATED ACTIVIT,040100,2022~353295,8037,Advanced Manufacturing,,,,,,,,,,,,,,,,,,,,,,,,,,,,,,,,,,,,,,,,,,,,,,,,,,,,,,,,,,,,,,,,,,,,,,,,,,,,,,,,,,,,,,,,,,,,,,,,,,,,,,,,,,,,,,,,,,,,,,,,,,,,,,,,,,,,,,,,,,,,
