Nonlinear Partial Differential Equations Methods in the Study of Interfaces,NSF,07/01/2022,06/30/2025,191324.00,191324,Standard Grant,03040000,MPS,Direct For Mathematical & Physical Scien,DMS,Division Of Mathematical Sciences,Marian Bocea,mbocea@nsf.gov,7032922595,"This project investigates partial differential equations (PDE) that arise in several areas of pure and applied mathematics. One of the main objectives is the formal derivation of physical models, whose mathematical description is based on PDE of nonlocal type, that describe the dynamics of defect lines in crystalline materials. In a different area, the PI will investigate the qualitative behavior of solutions to nonlinear elliptic PDE that model segregation phenomena. The project will fundamentally contribute to these fields by bridging the gap between mathematical analysis and physics and will enable further mathematical understanding of physical phenomena. The project provides research training opportunities for graduate students and postdoctoral researchers.&lt;br/&gt;&lt;br/&gt;At a technical level, the objective of this project is the study of forming interface surfaces through PDE methods. Thematic areas of focus are: (i) Nonlocal reaction-diffusion equations, where the main goals are to derive mesoscale and macroscopic scale models describing the dynamics of defect lines in crystals (dislocations) through the study of the asymptotic limits of Peierls-Nabarro models and to prove existence of heteroclinic and multibump orbits for systems of equations driven by fractional operators; and (ii) Segregation models and nonlinear eigenvalue problems. Here, the main objective is the analysis of nodal sets of segregated stationary configurations and their connection with eigenvalue problems for fully nonlinear operators.&lt;br/&gt;&lt;br/&gt;This award reflects NSF's statutory mission and has been deemed worthy of support through evaluation using the Foundation's intellectual merit and broader impacts review criteria.",06/16/2022,06/16/2022,,Grant,47.049,1,4900,4900,2155156,Stefania,Patrizi,,,Stefania Patrizi,spatrizi@math.utexas.edu,000732319,06/16/2022,,Principal Investigator,,,,,,,,,,,,,,,,,,,,,,,,,,,,,,,,,,,,,,,,,University of Texas at Austin,AUSTIN,787121139,5124716424,110 INNER CAMPUS DR,,United States,Texas,TX,25,TX25,V6AFQPN18437,UNIVERSITY OF TEXAS AT AUSTIN,X5NKD2NFF2V3,University of Texas at Austin,Austin,TX,787595316,"3925 W Braker Lane, Ste 3.340",US,United States,Texas,1,10,TX10,1281,ANALYSIS PROGRAM,,,,,,,,,2022~191324,,,,,,,,,,,,,,,,,,,,,,,,,,,,,,,,,,,,,,,,,,,,,,,,,,,,,,,,,,,,,,,,,,,,,,,,,,,,,,,,,,,,,,,,,,,,,,,,,,,,,,,,,,,,,,,,,,,,,,,,,,,,,,,,,,,,,,,,,,,,,,
Lanthanide Ion Complexes with Viscosity- or Temperature-dependent Emission,NSF,09/01/2022,08/31/2025,485000.00,485000,Continuing Grant,03090000,MPS,Direct For Mathematical & Physical Scien,CHE,Division Of Chemistry,Tingyu Li,tli@nsf.gov,7032924949,"In this project, funded by the Chemical Structure, Dynamics &amp; Mechanisms B and the Chemical Measurement and Imaging Programs of the Chemistry Division of the National Science Foundation, Professor Ana de Bettencourt-Dias and her research group at the University of Nevada, Reno, will isolate lanthanide ion complexes capable of metal-centered light emission. They plan to demonstrate that this light emission can be modulated by viscosity and temperature and they will study the compound design features that best enable this modulation.  With the ability to correlate the intensity of the emitted light with the temperature and the viscosity, the group will be able to measure the temperature and viscosity inside of the cells. These properties vary with the type of cell and are important properties to help in the diagnosis of disease and in the unraveling of cell metabolism.  The research is also of interest in the management of industrial processes, such as monitoring completion of polymerization and hydrogelation processes.  During the project, undergraduate and graduate students as well as postdoctoral scholars will be trained in the synthesis and spectroscopic techniques needed to successfully complete the proposed work. As part of the commitment to support the advancement and inclusivity of underrepresented minority faculty, Professor Ana de Bettencourt-Dias will continue mentoring junior colleagues and promoting their science through a variety of avenues, including, but not limited to, the Periodic TableTalks. &lt;br/&gt;&lt;br/&gt;Lanthanide ions display sharp emission profile. This emission, which arises from transitions within the 4f orbitals, is most efficiently sensitized through coordinated ligand chromophores. These chromophores can be designed to display an energy transfer to the emissive lanthanide ion, which is modulated by viscosity and temperature. In this project, Professor Ana de Bettencourt-Dias and her research group propose to isolate several new ligands, based on N-heterocycles and cyanovinyl molecular rotors, and to assess their ability to promote metal-ion centered emission as a function of the temperature and viscosity of the medium. In addition, they will study, by using heteroleptic complexes, which ligand functionalities enable the viscosity- and temperature-dependent emission through a two-photon excitation process.&lt;br/&gt;&lt;br/&gt;This award reflects NSF's statutory mission and has been deemed worthy of support through evaluation using the Foundation's intellectual merit and broader impacts review criteria.",04/04/2022,08/06/2022,,Grant,47.049,1,4900,4900,2155047,Ana,de Bettencourt-Dias,,,Ana de Bettencourt-Dias,abd@unr.edu,000488789,04/04/2022,,Principal Investigator,Hector,Abruna,D,,Hector D Abruna,hda1@cornell.edu,000479049,03/29/2022,,Co-Principal Investigator,Jin,Suntivich,,,Jin Suntivich,js2765@cornell.edu,000632809,03/29/2022,,Principal Investigator,,,,,,,,,,,,,,,,,,,,,"Board of Regents, NSHE, obo University of Nevada, Reno",RENO,895570001,7757844040,1664 N VIRGINIA ST,,United States,Nevada,NV,02,NV02,WLDGTNCFFJZ3,NEVADA SYSTEM OF HIGHER EDUCATION,E2N7LVJCNCW8,"Board of Regents, NSHE, obo University of Nevada, Reno",Reno,NV,895570001,1664 North Virginia Street,US,United States,Nevada,1,02,NV02,6880,Chemical Measurement & Imaging,7234,SENSORS NON-SOLICITATION RESEA,,,,01002223DB,NSF RESEARCH & RELATED ACTIVIT,040100,2022~485000,9150,EXP PROG TO STIM COMP RES,9102,"Chem Struct,Dynmcs&Mechansms B",,090Z,CAS-Critical Aspects of Sustainability,8396,Clean Energy Technology,8397,Hydrogen Storage or Generation,CAS-Climate: Electroadsorption Kinetics on Transition Metals: Measurement and Mechanism,NSF,07/01/2022,06/30/2025,542000.00,542000,Standard Grant,03090000,MPS,Direct For Mathematical & Physical Scien,CHE,Division Of Chemistry,Amanda Haes,ahaes@nsf.gov,7032927909,"With support from the Chemical Structure, Dynamics, and Mechanism A (CSDM-A) Program in the Division of Chemistry, Drs. Jin Suntivich and Héctor Abruña of Cornell University are investigating the mechanism of surface hydrogen formation on transition metals with well-defined structure and orientation. Electrochemical and non-linear spectroscopic measurements facilitate the formation of a conceptual framework for proton and electron transfers across the metal-water interface. Drs. Suntivich and Abruña and their students examine the electrode potential-dependent formation of surface hydrogen on metal single crystals because this reaction represents the first step in the evolution/production of hydrogen and involves only one electron and one proton. The team also investigates the influence of local variables such as interfacial electric field and surface chemistry on proton and electron-transfer kinetics. Non-linear spectroscopy is used to provide local electric field information at the metal-water interface. By advancing the mechanistic knowledge of electrochemical reactions, future catalysts that efficiently generate or evolve hydrogen from water could be designed. The team also  translates concepts in electrochemical and optical sciences to outreach activities through the New York Stat 4-H Youth Development program. The team is developing new curricular materials on chemical circularity for first year students at Cornell University.&lt;br/&gt; &lt;br/&gt;This project investigates the proton-coupled electron transfer (PCET) mechanism on well-defined single-crystal metal surfaces such as platinum and palladium. These heterogeneous electrochemical reactions are common in electrocatalysis; however, they are complex because most PCET reactions involve the transfer of multiple protons and electrons. The research team applies a time-dependent electro-analytical method and non-linear spectroscopy to probe surface hydrogen formation, which involves only one proton and one electron. These studies examine the surface hydrogen formation kinetics on single-crystal metal surfaces as a function of proton donor and metal chemistries as well as local electric field and surface oxide. Phase-sensitive second harmonic generation measurements are employed to characterize the local electric field during the electrochemical reaction. These investigations foster a deep understanding of the molecular picture during the heterogeneous PCET electrocatalysis mechanism.&lt;br/&gt;&lt;br/&gt;This award reflects NSF's statutory mission and has been deemed worthy of support through evaluation using the Foundation's intellectual merit and broader impacts review criteria.",03/29/2022,03/29/2022,,Grant,47.049,1,4900,4900,2155157,Cornell University,ITHACA,148502820,6072555014,341 PINE TREE RD,,United States,New York,NY,23,NY23,G56PUALJ3KT5,CORNELL UNIVERSITY,EQA8NBEN9WD5,Cornell University,,NY,148502820,,US,United States,New York,1,23,NY23,,,,01002223DB,NSF RESEARCH & RELATED ACTIVIT,040100,2022~542000,9101,"Chem Struct,Dynmcs&Mechansms A",,,,,,,,,,,,,,,,,,,,,,,,,,,,,,,,,,,,,,,,,,,,,,,,,,,,,,,,,,,,,,,,,,,,,,,,
"CI CoE: Demo Pilot: Advancing Research Computing and Data: Strategic Tools, Practices, and Professional Development",NSF,05/15/2021,04/30/2023,1497243.00,1497243,Standard Grant,05090000,CSE,Direct For Computer & Info Scie & Enginr,OAC,Office of Advanced Cyberinfrastructure (OAC),Varun Chandola,vchandol@nsf.gov,7032922656,"Research is increasingly dependent upon Cyberinfrastructure (CI), from instruments and sensors to Research Computing and Data (RCD) infrastructure and services. High Performance Computing (HPC) is an important element, however RCD has expanded well beyond HPC into secure enclaves for data compliance; big data management, analytics, and movement; AI/machine learning; and more recently into heterogeneous compute models, edge computing, and cloud-based computing. Researchers are struggling to keep pace with the explosion of data and the rapid evolution of computing resources, and often lack the skills to make full use of emerging tools and techniques. Developing and maintaining the needed expertise takes valuable time from research and is often beyond the capacity of researchers; they must depend upon partners (RCD professionals) who combine technology expertise and an understanding of research workflows and researcher needs. Institutions face challenges recruiting and retaining RCD professional staff, and building effective RCD support services. This CI CoE Demonstration Pilot (RCD CoE) will develop an RCD Resource and Career Center to advance and enable the nation's capacity for computational and data-intensive research by providing institutions and individuals the products, tools, services, and community to build and sustain successful RCD operations.  The project will also provide expertise in the development of new RCD professionals, and provide a voice and a connector for the broad community and the profession at large. &lt;br/&gt;&lt;br/&gt;The RCD Resource and Career Center will build upon work that the NSF-supported Campus Research Computing Consortium (CaRCC) has done and continues to do to develop products and tools for effective RCD support. The Center will develop a robust and sustainable implementation of the RCD Capabilities Model that provides an assessment framework, support for benchmarking and strategic planning, and a community data set to understand the landscape of RCD support. The Center will expand and disseminate resources for RCD Professionalization, including support for adoption of an RCD Job Family Matrix to properly classify RCD professional roles and conducting a national census of RCD Professionals to characterize the current state of RCD staff and programs. The Center will create and disseminate a model of Career Arcs for RCD Professionals to explain career options and help existing RCD professionals explore professional development and advancement. Work in the project will aggregate resources for staff training and workforce development, including leading practices for recruitment, onboarding, advancing diversity, equity and inclusion (DEI), and professional development, as well as proven models for student internship and training programs. The pilot period and the community of communities will be used to facilitate the creation of a coordinating organization to connect all the relevant communities and to develop a shared voice for RCD professionals as the project plans for a full Center of Excellence.&lt;br/&gt;&lt;br/&gt;This award reflects NSF's statutory mission and has been deemed worthy of support through evaluation using the Foundation's intellectual merit and broader impacts review criteria.",05/19/2021,05/19/2021,,Grant,47.070,1,4900,4900,2100003,Thomas,Cheatham,E,III,Thomas E Cheatham,tec3@utah.edu,000095070,05/19/2021,,Co-Principal Investigator,Dana,Brunson,,,Dana Brunson,dbrunson@internet2.edu,000548697,05/19/2021,,Principal Investigator,Scott,Yockel,,,Scott Yockel,syockel@g.harvard.edu,000753904,05/19/2021,,Co-Principal Investigator,Patrick,Schmitz,,,Patrick Schmitz,pschmitz@internet2.edu,000764398,05/19/2021,,Co-Principal Investigator,Claire,Mizumoto,E,,Claire E Mizumoto,claire@ucsd.edu,000829737,05/19/2021,,Co-Principal Investigator,INTERNET2,WASHINGTON,200363846,7349134264,1150 18TH ST NW,STE 900,United States,District of Columbia,DC,00,DC00,DZEBKFRD1ZN6,UNIVERSITY CORPORATION FOR ADVANCED INTERNET DEVELOPMENT,,Internet2,Washington,DC,200363825,1150 18th St NW,US,United States,District of Columbia,1,00,DC00,7231,CYBERINFRASTRUCTURE,9102,"WOMEN, MINORITY, DISABLED, NEC",0121,NSF RESEARCH & RELATED ACTIVIT,040100,01002122DB,NSF RESEARCH & RELATED ACTIVIT,040100,2021~1497243,090Z,CAS-Critical Aspects of Sustainability,6878,Chemical Synthesis,,8037,Advanced Manufacturing,8396,Clean Energy Technology,8398,Hydrocarbon Conversion,CAS: Organometallic Chemistry of High- and Low-Valent Nickel Centers,NSF,08/01/2022,07/31/2025,525000.00,170516,Continuing Grant,03090000,MPS,Direct For Mathematical & Physical Scien,CHE,Division Of Chemistry,George Richter-Addo,grichter@nsf.gov,7032927528,"With the support of the Chemical Synthesis program in the Division of Chemistry, Professor Liviu M. Mirica of the Department of Chemistry at the University of Illinois at Urbana-Champaign (UIUC) will study the electronic properties and reactivity profiles of uncommon but reactive complexes of nickel that help in the production of useful organic compounds. The proposed studies will include a combination of synthetic chemistry to make the compounds and advanced spectroscopy for the characterization of these compounds, and thus will provide students in the research laboratory an interdisciplinary training and the opportunity to develop a broad range of scientific skills. In addition, Professor Mirica has developed a collaboration with Michael Webb from the neighboring Illinois State University (ISU) that will allow students from ISU to visit Professor Mirica’s laboratory for research and advanced spectroscopy studies. The PI will continue to be active in recruiting and training graduate and undergraduate students from different backgrounds, and will participate in the Chemistry Community program at UIUC aimed at increasing graduation rates for STEM (science, technology, engineering and mathematics) majors from underrepresented groups.&lt;br/&gt;&lt;br/&gt;It is well-known that palladium (Pd)-based complexes feature prominently as catalysts for  cross-coupling reactions to generate C-C and C-X bonds. Nickel (Ni)-based systems have been recently developed given their generally broader substrate scope. This project by Professor Mirica deals with detailing the role of paramagnetic organometallic Ni complexes in important chemical transformations such as C-C and C-heteroatom bond formation and coupling. The project builds on Professor Mirica’s recent work in this area of chemistry of Ni chemistry, and will pursue the synthesis, isolation, detailed characterization, and reactivity studies of a series of organometallic Ni(III) complexes supported by flexible multidentate ligands. Novel organometallic Ni complexes in varied oxidation states will be isolated, characterized, and employed in new photocatalytic cross-coupling transformations. Professor Mirica and his group will investigate the photochemical and thermal reactivity of these Ni systems in detail, using the appreciable number of isolated organometallic Ni(III) and Ni(I) complexes expected to be synthesized in this project. The interdisciplinary training of students will span inorganic, organic, organometallic, and physical chemistry.&lt;br/&gt;&lt;br/&gt;This award reflects NSF's statutory mission and has been deemed worthy of support through evaluation using the Foundation's intellectual merit and broader impacts review criteria.",06/23/2022,06/23/2022,,Grant,47.049,1,4900,4900,2155160,University of Illinois at Urbana-Champaign,URBANA,618013620,2173332187,506 S WRIGHT ST,,United States,Illinois,IL,13,IL13,Y8CWNJRCNN91,UNIVERSITY OF ILLINOIS,,University of Illinois at Urbana-Champaign,Urbana,IL,618013620,506 S. Wright Street,US,United States,Illinois,1,13,IL13,,,,01002223DB,NSF RESEARCH & RELATED ACTIVIT,040100,2022~170516,,,Liviu,Mirica,M,,Liviu M Mirica,mirica@illinois.edu,000565995,06/23/2022,,Principal Investigator,8607,Solar Energy Capture&Conver,,,,,,,,,,,,,,,,,,,,,,,,,,,,,,,,,,,,,,,,,,,,,,,,,,,,,,,,,,,,
Transition Metal Catalysis of Electrocyclic Reactions,NSF,05/01/2022,04/30/2025,525000.00,525000,Standard Grant,03090000,MPS,Direct For Mathematical & Physical Scien,CHE,Division Of Chemistry,George Richter-Addo,grichter@nsf.gov,7032927528,"With the support of the Chemical Catalysis program in the Division of Chemistry, Professor Joseph O’Connor of the University of California, San Diego will study new ways to convert readily available acyclic organic compounds that contain multiple carbon-carbon double bonds into high-value cyclic compounds. This will be achieved by the design of new organometallic catalysts that provide a high degree of control over the three-dimensional structure of the product molecules. Organometallic catalysts are carbon- and metal-containing substances that, when added in trace amounts to a reaction mixture, speed up the conversion of starting materials to products. Catalysts permit lower reaction temperatures, thereby minimizing energy input and the associated production of green-house gases. In addition, catalysts prevent the formation of undesired byproducts and their associated negative environmental impacts. Novel approaches for the controlled generation of proposed intermediates will advance our understanding of a relatively unexplored but important area of hydrocarbon chemistry. The proposed research will contribute to future advances in the eco-friendly preparation of organic molecules with useful properties. Students, including women, persons with disabilities, and persons from underrepresented minority groups, will receive  will receive multidisciplinary training that spans mechanistic, synthetic, organometallic, and computational chemistry, thereby positioning them for future independent scientific contributions in both industry and academia.<br/><br/>Under with award, the O’Connor research group will study new ways to catalyze the electrocyclization of conjugated trienes. It is anticipated that these studies will lay a foundation for the development of new catalysts that facilitate challenging reactions that involve highly delocalized, nonpolar transition-state structures. The catalyst design innovations include metal catalysts with a facial array of three accessible metal coordination sites for the simultaneous interaction of the metal with three pi-bonds. Low temperature spectroscopy, X-ray crystallography, and computational studies will be utilized to reveal how hexadentate coordination perturbs polyene structures and induces disrotatory triene ring closure. By employing a chiral ancillary ligand, enantioselective electrocyclization will be targeted. Studies into metal-catalyzed electrocyclization will unlock new retro-synthetic approaches for the synthesis of complex biologically active compounds, designer ligands, and new materials. The scope and limitations of these new electrocyclization reactions will be studied in detail.<br/><br/>This award reflects NSF's statutory mission and has been deemed worthy of support through evaluation using the Foundation's intellectual merit and broader impacts review criteria.",04/05/2022,04/05/2022,,Grant,47.049,1,4900,4900,2155055,Joseph,O'Connor,M,,Joseph M O'Connor,jmoconnor@ucsd.edu,000280800,04/05/2022,,Principal Investigator,Mehrdad,Kalantar,,,Mehrdad Kalantar,kalantar@math.uh.edu,000704185,04/06/2022,,Principal Investigator,,,,,,,,,,,,,,,,,,,,,,,,,,,,,,,University of California-San Diego,LA JOLLA,920935004,8585344896,9500 GILMAN DR,,United States,California,CA,49,CA49,UYTTZT6G9DT1,"UNIVERSITY OF CALIFORNIA, SAN DIEGO",NUDGYLBB4S99,University of California-San Diego,La Jolla,CA,920930934,Office of Contract & Grant Admin,US,United States,California,1,49,CA49,6884,Chemical Catalysis,8037,Advanced Manufacturing,,,,,,,2022~525000,,,1281,ANALYSIS PROGRAM,8585345836,,,,,,,C*-algebras of Groups and Quantum Groups: Rigidity and Structure Theory,NSF,06/01/2022,05/31/2025,325855.00,325855,Standard Grant,03040000,MPS,Direct For Mathematical & Physical Scien,DMS,Division Of Mathematical Sciences,Marian Bocea,mbocea@nsf.gov,7032922595,"The theory of operator algebras was developed in the 1930s as the mathematical foundation of quantum mechanics. This theory is also a natural mathematical framework in which physical systems as they evolve in time (called dynamical systems) can be represented and studied; groups are the algebraic structures that represent the time in this picture. Groups also model symmetries of physical systems and mathematical structures, and since their formal introduction in the 19th century, their applications have expanded deep into almost every major area of mathematics. Representation theory of groups provides canonical ways to assign operator algebras to a given group, hence establishes a bridge between the two theories which allows one to import ideas and concepts from one theory to the other. The study of the connections between groups and their associated operator algebras has been a central part of operator algebra theory since the time of von Neumann, and it has had tremendous impact on both theories, as well as in several other related areas such as ergodic theory, dynamical systems, and representation theory. This project aims to make further progress in this direction by discovering new connections between structural properties of groups and their operator algebras. The project provides research training opportunities for graduate students. <br/><br/>The first part of the project is aimed at several conjectures and problems related to new operator-algebraic rigidity phenomena for discrete groups in terms of their C*-algebras. This is based on a new approach to extending important classical results from ergodic theory of higher rank groups to the operator-algebraic setting. The main concept of interest is that of invariant subalgebras of C*-algebras generated by unitary representations, which are viewed as non-commutative generalizations of normal subgroups. The boundary theory of groups (in the sense of Furstenberg) plays a central role in the Principal Investigator’s strategies to approach the proposed problems. Furstenberg's boundary theory has been, in the past few decades, a major tool in ergodic theory of higher rank lattices and in proving their rigidity properties. More recently, it has also been used in operator-algebraic rigidity problems, resulting in significant progress in this area. The project aims to develop new techniques in utilizing boundary actions in order to prove the proposed rigidity results for invariant subalgebras of C*-algebras generated by unitary representations of discrete groups. Another part of this project concerns several open problems regarding simplicity and unique trace property of C*-algebras of discrete quantum groups; the goal is to further develop the boundary theory of quantum groups and apply them in these problems.<br/><br/>This award reflects NSF's statutory mission and has been deemed worthy of support through evaluation using the Foundation's intellectual merit and broader impacts review criteria.",04/06/2022,04/06/2022,,Grant,47.049,1,4900,4900,2155162,University of Houston,HOUSTON,77004,7137435773,4800 W CALHOUN ST STE 316,,United States,Texas,TX,18,TX18,QKWEF8XLMTT3,UNIVERSITY OF HOUSTON SYSTEM,PH6HQZLPA687,University of Houston,Houston,TX,772042015,4800 Calhoun Boulevard,US,United States,Texas,1,18,TX18,,,,,,,2022~325855,,,,,,,,,,,,,,,7137430780,,,,,,,,,,,,,,,,,,,,,,,,,,,,,,,,,,,,,,,,,,,,,,,,,,,,,,,,,,,
